Sinh viên cần nắm vững những kiến thức gì ?,Chuẩn đầu ra tiếng Anh của trường mình là bao nhiêu ?,"Ngoài tiêu chuẩn đầu ra ngoại ngữ là tiếng anh, sinh viên có thể lựa chọn ngôn ngữ khác được không?","Đối với tiêu chuẩn đầu ra ngôn ngữ Nhật, trường yêu cầu tiếng Nhật bằng nào là có thể tốt nghiệp ?",Chứng chỉ giáo dục thể chất loại gì thì đủ điều kiện tốt nghiệp ?,,hồ sơ đăng ký ngoại ngữ ntn?,Điều kiện để xét tốt nghiệp đại học là gì?,Điểm số như thế nào thì bị cảnh cáo hay đình chỉ học?,khi nào sinh viên có kết quả thôi học ?,Điều kiện đủ để sinh viên có thể đăng ký học chương trình thứ 2 là gì?,khi nào sinh viên nộp đơn xin học chương trình 2 ?,lý do nào không may để bị buộc thôi học chương trình 2 ?  ,học chương trình 2 tại trường thì mọi quyền lợi có được tính như chương trình 1 không,Điều kiện để sinh viên được xét tốt nghiệp chương trình 2 là gì?
Bạn có được những kiến thức gì sau khi tốt nghiệp đại học ? ,Chuẩn đầu ra ngoại ngữ của sinh viên đại học kinh tế cần có là gì ?,Ngoài chuẩn đầu ra là bằng tiếng anh thì bằng ngôn ngữ khác được không?,Chuẩn đầu ra nếu như ngoại ngữ là tiếng Nhật thì cần bằng cấp nào ?,Để được cấp chứng chỉ giáo dục thể chất sinh viên phải có kết quả làm sao ?,,,làm sao để được xét tốt nghiệp ?,trường có đình chỉ sinh viên nếu học điểm thấp không ?,"sau khi sinh viên bị quyết định cho thôi học, nhà trường phả có nghĩa vụ như thế nào",Muốn học ngành 2 ở trường thì có điều kiện cơ bản gì?,"để đăng kí học thêm chương trình thứ 2, thì sinh viên phải làm như thế nào.",sinh viên dừng  chương trình 2 khi nào ?,Khi tham gia chương trình 2 thì sinh viên có quyền lợi về xét học bổng hay không?,để tốt nghiệp được chương trình 2 thì có ràng buộc hay liên quan gì đến chương trình 1 hay không?
Chuẩn đầu ra sinh viên cần nắm vững kiến thức gì ?,Yêu cầu về tiếng anh đầu ra để tốt nghiệp là gì ?,những chứng chỉ được chấp nhận ngoài chứng chỉ tiếng anh ?,Tiếng nhật có được trườngg chấp nhận không ?,Điểm trung bình tích luỹ 5 kì GDTC bao nhiêu thì được cấp chứng chỉ GDTC ?,,,điều kiện để xét tốt nghiệp,sinh viên rơi vào tình trạng như thế nào thì sẽ bị nhà trường cảnh cáo về học tâp?,Khi có quyết định thôi học thì thông tin đó có được chuyển đến gia đình hay không?,đăng ký nghành 2 dựa vào tiêu chí nào ?,Khi đăng kí chương trình 2 thì hố sơ sinh viên cần chuẩn bị những gì?,nếu học lực ở chương trình 2 yếu thì sẽ như thế nào,"Khi học thêm chương trình thứ hai, các chế độ quyền lợi của sinh viên, điểm xét học bổng chỉ được tính khi nào?",e có thể dừng chương trình 1 và chỉ học chương trình 2 để tốt nghiệp được không ?
Sinh viên cần nắm vững những kiến thức gì ?,Chuẩn đầu ra ngoại ngữ của khóa 42K là như thế nào ?,Có phải chỉ có tiếng anh mới là ngôn ngữ chuẩn đầu ra tại trường đại học kinh tế ?,Với ngôn ngữ tiếng nhật thì cấp độ nào là thỏa mãn chuẩn đầu ra.,Điều kiện điểm số để tốt nghiệp đối với môn giáo dục thể chất là như thế nào ?,,,Để xét công nhận tốt nghiệp thì sinh viên cần có đủ những điều kiện gì?,Đối với điểm tích lũy của các kì như thế nào thì sẽ không được công nhận tốt nghiệp?,Thời gian trường trả thông báo về địa phương nơi sinh viên có hộ khẩu thường trú đối với sinh viên có quyết định thôi học,điều kiện và hình thức học ở chương trình thứ 2,"Thời điểm nộp đơn khi sinh viên làm đơn xin học thêm chương trình thứ hai, chậm nhất là bao nhieu ngày trước khi bắt đầu kì học mới?",Nếu xếp hạng của ngành học 2 là học lực yếu thì sinh viên sẽ nhận kết quả như thế nào?,Học chương trình hai có được xét học bổng như chương trình thứ nhất không ạ?,"để được xét tốt nghiệp chương trình 2, thì có cần thiết phải hoàn thành chương trình một không"
Chuẩn đầu ra yêu cầu kiến thức như thế nào về chuyên ngành học ?,yêu cầu chuẩn đầu ra của trường về tiếng anh ?,"Ngoài tiếng anh, trường đại học kinh tế có chấp nhận những chứng chỉ ngôn những nào khác không ?",Ngoài bằng B1 của tiếng anh thì có chấp nhận bằng N4 của tiếng Nhật không?,tiêu chuẩn cấp chứng chỉ giáo dục thể chất ?,,,Quy định để được xét tốt nghiệp là gì?,Sinh viên bị nhà trường kỉ luật khi vi phạm các điều sau:,Đuổi học có thông báo về địa phương không ạ?,Khi đăng kí vào ngành học chương trình thứ 2 thì sinh viên cần có những điều kiện như thế nào?,Thời gian đăng ký học ngành hai là khi nào ạ?,"Sinh viên đang học thêm chương trình thứ hai, nếu rơi vào diện bị xếp hạng học lực yếu của chương trình thứ hai thì sẽ như thế nào?",ct 2 có đc hưởng quyền lợi j k?,Để xét tốt nghiệp chương tình thứ 2 thì điều kiện đối với chương trình thứ nhất như thế nào?
bạn sẽ nắm vững cái gì khi học ngành này ?,Chuẩn đầu ra một phần tại trường đại học kinh tế đà nẵng ?,Em học chứng chỉ khác ngoài tiếng anh có được chấp nhận để ra trường không ạ ?,Trường đại học kinh tế Đà Nẵng chấp nhận tối thiếu bằng tiếng Nhật loại gì ?,điểm trung bình chung tích lũy môn giáo dục thể chất đạt chuẩn bao nhiêu thì mới có thể cấp chứng chỉ giáo dục thể chất và lấy đó làm điều kiện tốt nghiệp ?,,,Hồ sơ xét tốt nghiệp bao gồm những gì ạ?,Khi nào thì bị đình chỉ học ạ?,,Điều kiện để sinh viên bước vào ngành đào tạo chính?,thủ tục đk ngành 2?,Khi nào thì bị dừng học chương trình hai ạ?,,Sinh viên chỉ được xét tốt nghiệp chương trình thứ hai khi nào?
Những kiến thức cơ bản cần có sau khi tốt nghiệp tại trường đại học kinh tế ?,Yêu cầu về chuẩn đầu ra ngoại ngữ đối với sinh viên đại học hệ chính quy từ khoá tuyển sinh năm 2015 ?,Ngoài tiếng anh thì ngoại ngữ khác có được chấp nhận không ?,Chuẩn đầu ra ngoại ngữ đối với tiếng Nhật là như thế nào ạ ?,Chúng chỉ giáo dục thể chất thì trung bình tích lũy bao nhiêu sẽ được công nhận đủ điều kiện tốt nghiệp ?,,,điều kiện xét tốt nghiệp?,bị kỷ luật khi nào?,,Học ngành hai cần điều kiện gì ạ?,,những điểm cần tránh khi học ct 2?,,Khi nào thì đủ điều kiện tốt nghiệp chương trình hai ạ?
"Những kiến thức về khoa học, kinh tế,....thì yêu cầu đối với sinh viên là như thế nào?",Chuẩn đầu ra đối tiếng Anh đối với sinh viên khóa 41k là như thế nào ạ ?,,Đối với ngoại ngữ tiếng nhật như thế nào ?,Sinh viên có điểm trung bình tích lũy 5 kì học giáo dục thể chất từ bao nhiêu trở lên thì được cấp chứng chỉ giáo dục thể chất và lấy làm điều kiện để tốt nghiệp ?,,,,,,đk đăng ký ngành thứ 2?,,,,khi nào ct 2 đc tốt nghiệp?
Những kiến thức nào cần nắm vững là gì ?,Chuẩn đầu ra ngoại ngữ của trường như thế nào ?,,,Điểm tích lủy môn giáo dục thể chất bao nhiêu là đạt chuẩn ạ ?,,,,,,,,,,
Kiến thức cơ bản cần nắm khi ra trường là những gì ?,,,,ĐK cấp bằng giáo dục thể chất ?,,,,,,,,,,
lĩnh vực nào bạn nắm vững ?,,,,,,,,,,,,,,
